"","X","X2016","X2017","X2018","X2019","X2020"
"1","Summary","<p> In 2016 ICES produced ecosystem overviews for four European ecoregions. These overviews provide a description of the ecosystems, identify the main human pressures, and explain how these pressures affect key ecosystem components. The Celtic Seas ecoregion overview, which covers the whole Irish EEZ including the West of Scotland, the Malin Shelf, the Irish Sea, and the Celtic Sea, is included in this section. </p> <p> The five most important pressures in the Celtic Seas ecoregion are selective extraction of species, abrasion, smothering, substrate loss, and nutrient and organic enrichment. These pressures are linked mainly to the following human activities: fishing, aquaculture, coastal construction, land-based industry, maritime transport, agriculture, dredging, and offshore structures for renewable and non-renewable energy sources. </p> <p> Figures more specific to Irish fisheries are included before the ICES overview. In general, relative fishing pressure has declined in the last ten years while relative spawning stock biomass has remained stable. In 2015/2016: <li> 35% of stocks were fished below F<sub>MSY</sub> (53% unknown) </li> <li> 30% of stocks have SSB above B<sub>TRIGGER</sub> (54% unknown) </li> <li> 20% of landings came from stocks fished above F<sub>MSY</sub> </li> <li> 96% of landings came from stocks having SSB above B<sub>TRIGGER</sub> </li> </p>","<p> In 2016 ICES produced ecosystem overviews for four European ecoregions. Two more ecoregions were added in 2017 and the first four are due to be reviewed in 2018. These overviews provide a description of the ecosystems, identify the main human pressures, and explain how these pressures affect key ecosystem components. The interactive version of the Celtic Seas ecoregion overview, which covers the whole Irish EEZ including the West of Scotland, the Malin Shelf, the Irish Sea, and the Celtic Sea, is available at: <a href&#8805 ""http://bit.ly/2y9mup3"" target&#8805 ""_blank"">Click Here</a>. </p> <p> The five most important pressures in the Celtic Seas ecoregion are selective extraction of species, abrasion, smothering, substrate loss, and nutrient and organic enrichment. These pressures are linked mainly to the following human activities: fishing, aquaculture, coastal construction, land-based industry, maritime transport, agriculture, dredging, and offshore structures for renewable and non-renewable energy sources. </p> <p> In the near future ICES will publish a fisheries overview for the Celtic Seas ecoregion. This overview will summarise the state of all of the assessed fish and shellfish stocks and the fishing pressures being applied to them. It will do so in more detail than the ecosystem overview. The framework for the advice will be structured as: ecosystem overview -> fisheries overview -> single stock advice. Information and plots similar to the as-yet-unpublished ICES fisheries overviews are included in the current and MSFD D3 sections of the Stock Book 2017. </p>","Work in progress","",""
"2","Considerations","FEAS advises that the following considerations should be taken into account when developing ecosystem based management objectives: <li> Fishing has impacted a number of commercial species, with some commercial species such as cod and whiting in the Irish Sea now being considered collapsed. A cod long term management plan is currently in place. </li> <li> Demersal fisheries in the Celtic Sea, Irish Sea, West of Scotland and Rockall are mixed fisheries, catching a large number of commercial and non-commercial species. Many of the species caught are discarded. Mixed fisheries do not only affect the commercial stocks that are presented in this Stock Book, but impact on the wider fish community. </li> <li> The ICES mixed fisheries advice for the Celtic Sea (7.b-c and 7.e-k) is included at the end of this section. However, ICES does not recommend specific mixed-fisheries catch opportunities as no mixed-fisheries management objectives are available. </li> <li> Discarding rates are also high on many commercial species in these areas. Recently introduced technical measures such as increased cod-end mesh size and square mesh panels in the Celtic Sea need to be monitored in order to evaluate their effectiveness. Certain demersal quota species are now subject to the demersal landing obligation. </li> <li> Demersal trawling impacts on benthic habitats and their communities. The resilience and recoverability of habitats varies depending on substrate type, biota and type of fishing gear. The overall impact of demersal trawling on the seabed needs to be evaluated in relation to the proportion of different habitats impacted (see Fig. 5.1.4 in ICES Ecosystem Overview). </li> <li> A number of rare endangered and/or vulnerable species of cetaceans, seals, seabirds and elasmobranchs are resident or transient in Irish waters. The management of fisheries needs to ensure that the conservation of these species is not compromised.</li> <li> Pelagic fish species such as herring, blue whiting, mackerel and horse mackerel are keystone food web species and changes in their abundance can have significant consequences up the marine food chain. </li> <li> Due to their low reproductive output and longevity, many deep-water fish species are very vulnerable to overfishing. High levels of exploitation have led to the depletion of many deep-water fish stocks in ICES subareas 6 and 7. </li> <li> NEAFC and the EU have already closed a number of areas on the Rockall Bank, the Hatton Bank, the Porcupine Bank and the western European Slope to bottom impacting fishing gear, where cold water corals are known to occur. The UK is also in the process of establishing MPAs in a number of deep-water sites such as Rosemary Bank Seamount, Anton Dohrn, and The Canyons. Furthermore, the proposed EU deep-sea trawling ban, which could begin as early as January 2017, will restrict fishing below 800m with mobile bottom contacting gears. </li> <li> Deepwater species are dependent on nutrient input from the upper ocean layers via planktonic snow, mesopelagic species and fall of carcasses. This should be taken into account when considering the development of commercial fisheries for mesopelagic species. </li> <li> In order to implement the ecosystem approach to fisheries (EAFM), fisheries management should incentivise fishing behaviour and introduce management tools that reduce the impact of fishing on the wider ecosystem. </li>","FEAS advises that the following considerations should be taken into account when developing ecosystem based management objectives: <li> Fishing has impacted a number of commercial species, with some commercial species such as cod West of Scotland and whiting in the Irish Sea now being considered collapsed. </li> <li> Demersal fisheries in the Celtic Sea, Irish Sea, West of Scotland and Rockall are mixed fisheries, catching a large number of commercial and non-commercial species. Many of the species caught are discarded. Mixed fisheries do not only affect the commercial stocks that are presented in this Stock Book , but impact on the wider fish community. </li> <li> Discarding rates are also high on many commercial species in these areas. Certain demersal and pelagic quota species are now subject to the demersal landing obligation.</li> <li> Demersal trawling impacts on benthic habitats and their communities. The resilience and recoverability of habitats varies depending on substrate type, biota, and type of fishing gear. The overall impact of demersal trawling on the seabed needs to be evaluated in relation to the proportion of different habitats impacted (see Fig. 5.1.4 in ICES Ecosystem Overview). </li> <li> A number of rare, endangered and/or vulnerable species of cetaceans, seals, seabirds and elasmobranchs are resident or transient in Irish waters. The management of fisheries needs to ensure that the conservation of these species is not compromised. </li> <li> Pelagic fish species such as herring, blue whiting, mackerel and horse mackerel are keystone food web species and changes in their abundance can have significant consequences up the marine food chain. </li> <li> Due to their low reproductive output and longevity, many deep-water fish species are very vulnerable to overfishing. High levels of exploitation have led to the depletion of many deepwater fish stocks in ICES subareas 6 and 7. </li> <li> NEAFC and the EU have already closed a number of areas on the Rockall Bank, the Hatton Bank, the Porcupine Bank and the western European Slope to bottom impacting fishing gear, where cold water corals are known to occur. The UK is also in the process of establishing MPAs in a number of deep-water sites such as Rosemary Bank Seamount, Anton Dohrn, and The Canyons. Furthermore, the EU deep-sea trawling ban now restricts fishing below 800m with mobile bottom contacting gears. </li> <li> Deepwater species are dependent on nutrient input from the upper ocean layers via planktonic snow, mesopelagic species and fall of carcasses. This should be taken into account when considering the development of commercial fisheries for mesopelagic species.</li> <li> In order to implement the ecosystem approach to fisheries (EAFM), fisheries management should incentivise fishing behaviour and introduce management tools that reduce the impact of fishing on the wider ecosystem. </li> <li> Overall fishing pressure on the commercial fish and shellfish stocks in the Celtic Seas ecoregion has decreased since its peak in 1998 and the average F to F<sub>MSY</sub> ratios for the combined demersal, flatfish, and pelagic stocks is now close to F<sub>MSY</sub>. </li> <li> Overall biomass of commercial fish and shellfish stocks in the Celtic Sea has increased and the average SSB to B<sub>TRIGGER</sub> ratio for the combined demersal, shellfish, and pelagic stocks in the Celtic Seas ecosystem is now above B<sub>TRIGGER</sub>.</li> <li> The fishing effort of bottom mobile gears in the Celtic Seas ecoregion decreased by 35% from 2003 to 2014. This has reduced the spatial fishing footprint and the average number of times the seabed is trawled per year.</li> <li> Temperature affects the migration, distribution, and onset of spawning of blue whiting Micromesistius poutassou, Northeast Atlantic mackerel Scomber scombrus, western horse mackerel Trachurus trachurus, and boarfish Capros aper.</li> <li> Sea temperature affects the recruitment of some gadoids in the Irish Sea, Celtic Sea, and west of Scotland. The Celtic Seas ecoregion is at the edge of the geographical range of several species, potentially making these species more susceptible to environmental variation.</li>","Work in progress","",""
"3","PressureState","<p> Relative fishing pressure (F/F<sub>MSY</sub>) and biomass (SSB/B<sub>TRIGGER</sub>) are shown for each of four Irish ecoregions (Irish Sea, Celtic Sea, West of Scotland, and Widely Distributed). Each plot on the top left shows SSB and F related against reference points (MSY where available, otherwise PA or qualitative). Stocks in the green region are exploited below F<sub>MSY</sub> and have an SSB that is above B<sub>TRIGGER</sub>. Stocks of unknown status are depicted in the top right plot. In both plots the size of each bubble corresponds to the landings of each stock in 2015. FU refers to <em>Nephrops</em> functional units. </p> <p> The pie charts depict the proportion of the total 2015 landings in each region fished at or below F<sub>MSY</sub> (green), above F<sub>MSY</sub> (red) and of unknown status (grey) in relation to fishing mortality reference points (bottom left) and with biomass above B<sub>TRIGGER</sub> (green), below B<sub>TRIGGER</sub> (red) and of unknown status in relation to biomass reference points (bottom right). </p>","<p> To assess progress towards GES the average ratio of F/F<sub>MSY</sub> and B/B<sub>MSY</sub> is plotted for demersal, pelagic and <em>Nephrops</em> stock seperately below (Figure 4). These plots show that pelagic stocks have on average been fished below F<sub>MSY</sub> since the mid 2000s. The <em>Nephrops</em> stocks have fluctuated around F<sub>MSY</sub> throughout the time series. The largest change can be seen in demersal stocks where on average F was three times F<sub>MSY</sub> up to the mid 2000s and there has been a declining trend towards F<sub>MSY</sub> since then. Average biomass for <em>Nephrops</em> and pelagic stocks has fluctuated above MSY B<sub>TRIGGER</sub> throught the time series. The average biomass of demersal stocks shows an increasing trend since the mid 2000s and is now above MSY B<sub>TRIGGER</sub>.</p> <p>The ratio of F in 2016 to F<sub>MSY</sub> and biomass in 2016 to MSY B<sub>TRIGGER</sub> for all the stocks with D3C1 and D3C2 assessments are plotted below (Figure 5). The stock codes used by ICES are shown to identify the individual stocks. The stocks with green points are those with GES in 2017. The stocks with red dots do not have GES. This plot shows that cod in the west of Scotland (cod.27.6a) is in the worst condition of all stocks with a very low biomass (close to zero) and an F that is several times F<sub>MSY</sub>. Others stock in very poor condition include whiting in the Irish Sea (whg,27.7a) and plaice in 7.h-k (ple.27.7h-k). The majority of other stocks without GES are either close to the targets or with biomasses above MSY B<sub>TRIGGER</sub>. There are also a number of depleted stocks which now have low fishing mortality but their biomasses are yet to recover. These are in the bottom left quadrant and include Irish Sea sole (sol.27.7a), herring west of Scotland (her.276a7bc) and whiting west of Scotland (whg-scow).</p> <p>The bar plot (Figure 6) shows the catches or landings by stock sorted from highest volume to lowest volume. The colour of the bar indicates whether the stock has GES status (green &#8805 yes, red &#8805 no, grey &#8805 unknown). Circles indicate landings, whereas triangles are catches. The two very high volume stocks, blue whiting (whb-comb) and mackerel (mac-nea), were both overfished in 2016. These stocks account for a large proportion of the landed biomass in 2016. Although overfished in relation to F<sub>MSY</sub> both stocks have biomasses above MSY B<sub>TRIGGER</sub>. </p>","<p>To assess progress towards GES the average ratio of F/F<sub>MSY</sub> and B/B<sub>MSY</sub> is presented for demersal, pelagic and <em>Nephrops</em> stock seperately below (Figure 1). It should be noted these trends have not been updated since last year, owing to problems with the data received from ICES. These plots show that pelagic stocks have on average been fished below F<sub>MSY</sub> since the mid 2000s. The <em>Nephrops</em> stocks have fluctuated around F<sub>MSY</sub> throughout the time series. The largest change can be seen in demersal stocks where on average F was three times F<sub>MSY</sub> up to the mid 2000s and there has been a declining trend towards F<sub>MSY</sub> since then. Average biomass for <em>Nephrops</em> and pelagic stocks has fluctuated above MSY B<sub>trigger</sub> throught the time series. The average biomass of demersal stocks shows an increasing trend since the mid 2000s and is now above MSY B<sub>trigger</sub>.</p> <p>The ratio of F in 2017 to F<sub>MSY</sub> and biomass in 2017 to MSY B<sub>trigger</sub> for all the stocks with D3C1 and D3C2 assessments are plotted below (Figure 2). The stock codes used by ICES are shown to identify the individual stocks. The stocks with green points are those with GES in 2017. The stocks with red dots do not have GES. This plot shows that cod in the west of Scotland (cod.27.6a) is in the worst condition of all stocks with a very low biomass (close to zero) and an F that is several times F<sub>MSY</sub>. Others stock in very poor condition include whiting in the Irish Sea (whg,27.7a) and plaice in 7.h-k (ple.27.7h-k). The majority of other stocks outwith GES are either close to the targets or with biomasses above MSY B<sub>trigger</sub>. There are also a number of depleted stocks which now have low fishing mortality but their biomasses have yet to recover. These are in the bottom left quadrant and include Irish Sea sole (sol.27.7a), herring west of Scotland (her.276a7bc) and whiting west of Scotland (whg-scow).</p> <p>The bar plot (Figure 3) shows the catches or landings by stock sorted from highest volume to lowest volume. The colour of the bar indicates whether the stock has GES status (green &#8805 yes, red &#8805 no, grey &#8805 unknown). Circles indicate landings, whereas triangles are catches. The two very high volume stocks, blue whiting (whb-comb) and mackerel (mac-nea), were both overfished in 2017. These stocks account for a large proportion of the landed biomass in 2017. Although overfished in relation to F<sub>MSY</sub> both stocks have biomasses above MSY B<sub>trigger</sub>. </p>","",""
